{
  "version": "0.1",
  "timestamp": "2026-07-02T22:25:17.4807837+00:00",
  "nodes": [
    {
      "id": "tables/customers",
      "type": "BigQuery Table",
      "title": "Customers",
      "label": "customers",
      "description": "Customer records.",
      "path": "tables/customers.md",
      "degree": 1,
      "in": 1,
      "out": 0,
      "weight": 0.6491228788227412,
      "rank": 1
    },
    {
      "id": "tables/orders",
      "type": "BigQuery Table",
      "title": "Orders",
      "label": "Orders",
      "description": "One row per order.",
      "path": "tables/orders.md",
      "degree": 1,
      "in": 0,
      "out": 1,
      "weight": 0.3508771211772586,
      "rank": 2
    }
  ],
  "edges": [
    {
      "source": "tables/orders",
      "target": "tables/customers",
      "id": "to_tc",
      "label": "customers"
    }
  ]
}